{
  "$schema": "../schemas/building.schema.json",
  "id": "large_classroom_hall",
  "name": "Large Classroom Hall",
  "category": "academic",
  "footprint": { "w": 6, "h": 6 },
  "cost_usd": 25000000,
  "upkeep_usd_per_year": 700000,
  "capacity": { "kind": "seats", "value": 1800 },
  "style": "georgian_revival",
  "unlock_era": "founding",
  "needs_served": ["study"],
  "model": null,
  "design_ref": "§11.1"
}
